item,xmlId,parentTag,description
1230,rxDateHormone,Tumor,Date of initiation for hormone therapy that is part of the first course of treatment. See also RX Summ--Hormone [1400]. See Chapter X for date format.Formerly RX Date--Hormone. 
1231,rxDateHormoneFlag,Tumor,"This flag explains why no appropriate value is in the field, RX Date Hormone [1230].Formerly RX Date--Hormone Flag. "
3170,rxDateMostDefinSurg,Tumor,Date of most definitive surgical resection of the primary site performed as part of the first course of treatment. See Chapter X for date format. Use RX DATE MST DEFN SRG FLAG [3171] if there is no appropriate or known date for this item.      Formerly RX Date--Most Defin Surg. 
3171,rxDateMostDefinSurgFlag,Tumor,"This flag explains why no appropriate value is in the field, RX Date Mst Defn Srg [3170].           "
1250,rxDateOther,Tumor,Date of initiation for other treatment that is part of the first course of treatment at any facility. See RX Summ--Other [1420]. See Chapter X for date format.Formerly RX Date--Other. 
1251,rxDateOtherFlag,Tumor,"This flag explains why no appropriate value is in the field, RX Date Other [1250].Formerly RX Date--Other Flag. "
3220,rxDateRadiationEnded,Tumor,The date on which the patient completes or receives the last radiation treatment at any facility. See Chapter X for date format. Use RX DATE RAD ENDED FLAG [3221] if there is no appropriate or known date for this item.      Formerly RX Date--Radiation Ended.   
3221,rxDateRadiationEndedFlag,Tumor,"This flag explains why no appropriate value is in the field, RX Date Rad Ended [3220]. "
1210,rxDateRadiation,Tumor,Records the date on which radiation therapy began at any facility that is part of the first course of treatment. See Chapter X for date format. Use RX DATE RADIATION FLAG [1211] if there is no appropriate or known date for this item.Formerly RX Date--Radiation 
1211,rxDateRadiationFlag,Tumor,"This flag explains why no appropriate value is in the field, RX Date Radiation [1210].Formerly RX Date--Radiation Flag. "
3180,rxDateSurgicalDisch,Tumor,Records the date the patient was discharged following primary site surgery. The date corresponds to the event recorded in RX Date Mst Defn Srg [3170]. See Chapter X for date format. Use RX DATE SURG DISCH FLAG [3181] if there is no appropriate or known date for this item.      Formerly RX Date--Surgical Disch.  
3181,rxDateSurgicalDischFlag,Tumor,"This flag explains why no appropriate value is in the field, RX Date Surg Disch [3180]. "
1200,rxDateSurgery,Tumor,"Date the first surgery of the type described under Surgery of Primary Site, Scope of Regional Lymph Node Surgery, or Surgery of Other Regional Site(s), Distant Site(s) or Distant Lymph Nodes was performed. See also RX Summ--Surg Prim Site [1290], RX Summ--Scope Reg LN Sur [1292], and RX Summ--Surg Oth Reg/Dis [1294]. See Chapter X for date format.       Formerly RX Date--Surgery. "
1201,rxDateSurgeryFlag,Tumor,"This flag explains why no appropriate value is in the field, RX Date Surgery [1200]. Formerly RX Date--Surgery Flag."
3230,rxDateSystemic,Tumor,"Date of initiation of systemic therapy that is part of the first course of treatment. Systemic therapy includes the administration of chemotherapy agents, hormone agents, biological response modifiers, bone marrow transplants, stem cell harvests, and surgical and/or radiation endocrine therapy. See Chapter X for date format. Use RX DATE SYSTEMIC FLAG [3231] if there is no appropriate or known date for this item.      Formerly RX Date--Systemic.  "
3231,rxDateSystemicFlag,Tumor,"This flag explains why no appropriate value is in the field, RX Date Systemic [3230]. "
665,,,"This new data item was proposed for inclusion in Version 12 but the request was withdrawn prior to implementation of the standard. The data item was retired in Version 12.1, as of January 1, 2011."
720,rxHospBrm,Tumor,Records whether immunotherapeutic agents (biologic response modifiers) were administered as first-course treatment at this facility or the reason they were not given. Immunotherapy consists of biological or chemical agents that alter the immune system or change the host’s response to tumor cells. 
700,rxHospChemo,Tumor,Records the type of chemotherapy administered at the reporting facility as a part of first course therapy or the reason chemotherapy was not given. 
740,rxHospDxStgProc,Tumor,Identifies the surgical procedure(s) performed in an effort to diagnose and/or stage disease at this facility. 
710,rxHospHormone,Tumor,Records whether systemic hormonal agents were administered as first-course treatment at this facility or the reason they were not given. Hormone therapy consists of a group of drugs that may affect the long-term control of a cancer’s growth. It is not usually used as a curative measure. 
730,rxHospOther,Tumor,"Identifies treatment given at this facility that cannot be defined as surgery, radiation, or systemic therapy according to the defined data items in this manual. Treatment for reportable hematopoietic diseases can be supportive care, observation, or any treatment that does not meet the usual definition in which treatment modifies, controls, removes, or destroys proliferating cancer tissue. Supportive care such as phlebotomy, transfusions, or aspirin may be recorded for hematopoietic diseases ONLY. "
3280,rxHospPalliativeProc,Tumor,"Identifies care provided at the reporting facility in an effort to palliate or alleviate symptoms. Palliative procedures may include surgery, radiation therapy, systemic therapy (chemotherapy, hormone therapy, or other systemic drugs), and/or pain management. "
690,rxHospRadiation,Tumor,Defines the type of radiation therapy the patient received at the reporting facility as a part of the first course of treatment.
676,rxHospRegLnRemoved,Tumor,Describes number of regional lymph nodes removed at the reporting facility as part of the first course of treatment. 
747,rxHospScopeReg9802,Tumor,"Describes the removal, biopsy, or aspiration of regional lymph node(s) at the time of surgery of the primary site or during a separate surgical event at the reporting facility. This field is to be used for ROADS codes after the ROADS to FORDS conversion. It is also to be used to code Scope of Regional Lymph Node Surgery at the reporting facility for all tumors diagnosed before January 1, 2003. "
672,rxHospScopeRegLnSur,Tumor,"Describes the removal, biopsy, or aspiration of regional lymph node(s) performed at the reporting facility for diagnosis and/or staging or as a part of the first course of therapy. "
742,,,"The NAACCR UDSC retired this data item in Version 11, as of January 1, 2006."
743,,,"The NAACCR UDSC retired this data item in Version 11, as of January 1, 2006."
744,,,"The NAACCR UDSC retired this data item in Version 11, as of January 1, 2006."
745,,,"The NAACCR UDSC retired this data item in Version 11, as of January 1, 2006."
668,rxHospSurgApp2010,Tumor,"This item is used to describe the   method of surgical approach used for patients undergoing surgery of the primary site at the reporting facility. If the patient has multiple surgeries to the primary site, this item describes the approach used for the most invasive, definitive surgery "
748,rxHospSurgOth9802,Tumor,"Records the surgical removal of distant lymph nodes or other tissue(s)/organ(s) beyond the primary site at this facility. This field is to be used for ROADS codes after the ROADS to FORDS conversion. It is also to be used to code Surgery Other Regional/Distant Sites at the reporting facility for all tumors diagnosed before January 1, 2003. "
674,rxHospSurgOthRegDis,Tumor,Records the surgical removal of distant lymph nodes or other tissue(s)/organ(s) beyond the primary site performed at this facility as a part of first course of treatment. 
670,rxHospSurgPrimSite,Tumor,"Describes surgical procedures used to treat the primary site of the reportable tumor. This item records that portion of the first course of treatment given at the reporting facility. See Chapter V, Unresolved Issues, for a discussion of differences in treatment coding among groups and over time. "
746,rxHospSurgSite9802,Tumor,"Describes surgical procedures used to treat the primary site of the reportable tumor. This item records that portion of the first course of treatment given at the reporting facility. This field is to be used for ROADS codes after the ROADS to FORDS conversion. It is also to be used to code Surgery Primary Site at the reporting facility for all tumors diagnosed before January 1, 2003. See Chapter V, Unresolved Issues, for a discussion of differences in treatment coding among groups and over time. "
678,,,"This new data item was proposed for inclusion in Version 12 but the request was withdrawn prior to implementation of the standard. The data item was retired in Version 12.1, as of January 1, 2011."
1410,rxSummBrm,Tumor,Records whether immunotherapeutic (biologic response modifiers) agents were administered as first-course treatment at all facilities or the reason they were not given. Immunotherapy consists of biological or chemical agents that alter the immune system or change the host’s response to tumor cells. 
1390,rxSummChemo,Tumor,Codes for chemotherapy given as part of the first course of treatment or the reason chemotherapy was not given. Includes treatment given at all facilities as part of the first course. 
1350,rxSummDxStgProc,Tumor,Identifies the surgical procedure(s) performed in an effort to diagnose and/or stage disease. 
1400,rxSummHormone,Tumor,"Records whether systemic hormonal agents were administered as first-course treatment at any facility, or the reason they were not given. Hormone therapy consists of a group of drugs that may affect the long-term control of a cancer’s growth. It is not usually used as a curative measure. "
1420,rxSummOther,Tumor,"Identifies other treatment given at all facilities that cannot be defined as surgery, radiation, or systemic therapy according to the defined data items in this manual. Treatment for reportable hematopoietic diseases can be supportive care, observation, or any treatment that does not meet the usual definition in which treatment modifies, controls, removes, or destroys proliferating cancer tissue. Such treatments include phlebotomy, transfusions, and aspirin. "
3270,rxSummPalliativeProc,Tumor,"Identifies any care provided in an effort to palliate or alleviate symptoms. Palliative care is performed to relieve symptoms and may include surgery, radiation therapy, systemic therapy (chemotherapy, hormone therapy, or other systemic drugs), and/or pain management therapy. "
1370,rxSummRadToCns,Tumor,"For lung and leukemia cases only, codes for radiation given to the brain or central nervous system. Includes treatment given at all facilities as part of the first course. See Chapter V, Unresolved Issues, for more information.
Note: SEER does not collect this data item beginning with 1998 cases. They retain the codes for older cases in this field, and they have also recoded radiation coded here as radiation in RX Summ--Radiation [1360]. CoC does not collect this data item beginning with 1996 cases. "
1360,rxSummRadiation,Tumor,Codes for the type of radiation therapy performed as part of the first course of treatment.
1330,rxSummReconstruct1st,Tumor,"Codes for surgical procedures done to reconstruct, restore, or improve the shape and appearance or function of body structures that are missing, defective, damaged, or misshapen by cancer or therapies. Reconstructive/restorative procedures are coded here when started during the first course of therapy. CoC introduced site-specific codes for this item in the CoC ROADS Manual 1998 Supplement. RX Coding System--Current [1460] identifies which coding system applies.SEER collects reconstructive procedures for breast cancer tumors only.For reconstructive/restorative procedures performed later, see Subseq RX--Reconstruct Del [1741]. See also RX Summ--Surgery Type [1640]. "
1296,rxSummRegLnExamined,Tumor,Codes for the number of regional lymph nodes examined in conjunction with surgery performed as part of the first-course treatment. This includes treatment given at all facilities as part of the first course of treatment. See also RX Summ--Scope Reg LN Sur [1292]. 
1647,rxSummScopeReg9802,Tumor,"Describes the removal, biopsy or aspiration of regional lymph node(s) at the time of surgery of the primary site or during a separate surgical event at all facilities. This field is to be used for ROADS codes after the ROADS to FORDS conversion. It is also to be used to code Scope of Regional Lymph Node Surgery at all facilities for all tumors diagnosed before January 1, 2003. "
1292,rxSummScopeRegLnSur,Tumor,"Describes the removal, biopsy or aspiration of regional lymph node(s) at the time of surgery of the primary site or during a separate surgical event at all facilities. "
1642,,,"The NAACCR UDSC retired this data item in Version 11, as of January 1, 2006."
1643,,,"The NAACCR UDSC retired this data item in Version 11, as of January 1, 2006."
1644,,,"The NAACCR UDSC retired this data item in Version 11, as of January 1, 2006."
1645,,,"The NAACCR UDSC retired this data item in Version 11, as of January 1, 2006."
1648,rxSummSurgOth9802,Tumor,"Records the surgical removal of distant lymph nodes or other tissue(s)/organ(s) beyond the primary site given at all facilities as part of the first course of treatment. This field is to be used for ROADS codes after the ROADS to FORDS conversion. It is also to be used to code Surgery Regional/Distant Sites at all facilities for all tumors diagnosed before January 1, 2003. "
1294,rxSummSurgOthRegDis,Tumor,Records the surgical removal of distant lymph nodes or other tissue(s)/organ(s) beyond the primary site. 
1290,rxSummSurgPrimSite,Tumor,Site-specific codes for the type of surgery to the primary site performed as part of the first course of treatment. This includes treatment given at all facilities as part of the first course of treatment. 
1646,rxSummSurgSite9802,Tumor,"Site-specific codes for the type of surgery to the primary site performed as part of the first course of treatment. This includes treatment given at all facilities as part of the first course of treatment. This field is to be used for ROADS codes after the ROADS to FORDS conversion. It is also to be used to code Surgery Primary Site at all facilities for all tumors diagnosed before January 1, 2003. "
1380,rxSummSurgRadSeq,Tumor,"Codes for the sequencing of radiation and surgery given as part of the first course of treatment. See also RX Summ--Surg Prim Site [1290], RX Summ--Scope LN Surg [1292], RX Summ--Surg Oth Reg/Dis [1294], and RX Summ--Radiation [1360]. "
1640,rxSummSurgeryType,Tumor,"Field for pre-1996 surgery codes for CoC and pre-1998 surgery codes for SEER. Surgery codes used 1998 and later can be backward converted into the older codes and the converted value can be stored in this field. See Chapter V, Unresolved Issues, for discussion of CoC/SEER differences in coding treatment. "
1310,rxSummSurgicalApproch,Tumor,Codes for method used to approach the surgical field for the primary site. 
1320,rxSummSurgicalMargins,Tumor,Codes describe the final status of surgical margins after resection of the primary tumor. See also RX Summ--Surg Prim Site [1290]. 
1639,rxSummSystemicSurSeq,Tumor,"Records the sequencing of systemic therapy (RX Summ-Chemo [1390], RX Summ-Hormone [1400], RX Summ-BRM [1410], and RX Summ-Transplnt/Endocr [3250]) and surgical procedures given as part of the first course of treatment. See also RX Summ--Surg Prim Site [1290], RX Summ--Scope LN Surg [1292], and RX Summ--Surg Oth Reg/Dis [1294]. "
3250,rxSummTransplntEndocr,Tumor,"Identifies systemic therapeutic procedures administered as part of the first course of treatment at this and all other facilities. If none of these procedures were administered then this item records the reason they were not performed. These include bone marrow transplants, stem cell harvests, surgical and/or radiation endocrine therapy. "
1285,rxSummTreatmentStatus,Tumor,"This data item is a summary of the status for all treatment modalities. It is used in conjunction with Date Initial RX SEER [1260] and/or Date 1st Crs RX CoC [1270] and each modality of treatment with their respective date field to document whether treatment was given or not given, whether it is unknown if treatment was given, or whether treatment was given on an unknown date. Also indicates active surveillance (watchful waiting). This data item is effective for January 2010+ diagnoses. "
2660,rxTextBrm,Tumor,Text area for manual documentation of information regarding the treatment of the tumor being reported with biological response modifiers or immunotherapy.  
2640,rxTextChemo,Tumor,Text area for manual documentation of information regarding chemotherapy treatment of the reported tumor. 
2650,rxTextHormone,Tumor,Text area for information about hormonal treatment. 
2670,rxTextOther,Tumor,"Text area for manual documentation of information regarding the treatment of the tumor being reported with treatment that cannot be defined as surgery, radiation, or systemic therapy. This includes experimental treatments (when the mechanism of action for a drug is unknown), and blinded clinical trials. If the mechanism of action for the experimental drug is known, code to the appropriate treatment field. "
2620,rxTextRadiation,Tumor,Text area for manual documentation of information regarding treatment of the tumor being reported with beam radiation.
2630,rxTextRadiationOther,Tumor,Text area for manual documentation of information regarding treatment of the tumor being reported with radiation other than beam radiation. This includes brachytherapy and systemic radiation therapy.
2610,rxTextSurgery,Tumor,Text area for information describing all surgical procedures performed as part of treatment.
3923,sCategoryClinical,Tumor,"S Category Clinical combines the results of pre-orchiectomy Alpha Fetoprotein (AFP), Human Chorionic Gonadotropin (hCG) and Lactate Dehydrogenase (LDH) into a summary S value."
3924,sCategoryPathological,Tumor,"S Category Pathological combines the results of post-orchiectomy Alpha Fetoprotein (AFP), Human Chorionic Gonadotropin (hCG) and Lactate Dehydrogenase (LDH) into a summary S value."
3925,sarcomatoidFeatures,Tumor,Sarcomatoid features: present or absent and percentage refers to the observation of sheets and fascicles of malignant spindle cells in a kidney tumor which can occur across all histologic subtypes. The percentage of sarcomatoid component has been shown to correlate with cancer-specific mortality.
3926,schemaDiscriminator1,Tumor,"Captures additional information needed to generate AJCC ID [995] and Schema ID [3800] for some anatomic sites. Discriminators can be based on sub site, histology or other features which affect prognosis."
3927,schemaDiscriminator2,Tumor,"Captures additional information needed to generate AJCC ID [995] and Schema ID [3800] for some anatomic sites. Discriminators can be based on sub site, histology or other features which affect prognosis."
3928,schemaDiscriminator3,Tumor,"Captures additional information needed to generate AJCC ID [95] and Schema ID [3800] for some anatomic sites. Discriminators can be based on sub site, histology or other features which affect prognosis."
3800,schemaId,Tumor,"The derived values in this data item link Site-Specific Data Items (including grade data items) with the appropriate site/histology grouping and accounts for every combination of primary site and histology. The values for this data item are derived based on primary site, histology, and schema discriminator fields (when required). The derived values link Site-Specific Data Items with the appropriate site/histology grouping. For example, the Schema ID for an adenocarcinoma of the lung is 00360. This value links the Site-Specific Data Items associated with adenocarcinoma of the lung: Separate Tumor Nodules [3929], Visceral and Parietal Pleural Invasion [3937], and Pleural Effusion [3913]. The Schema ID would also link to the appropriate grade data items an adenocarcinoma of the lung. The AJCC ID [995] code for Lung is 36. The AJCC ID [995] would link to the AJCC TNM Data items (Clin T, Clin N, Etc.) specific to Lung. AJCC ID [995] will not be assigned when a site/histology combination is not eligible for TNM staging. "
510,,,"The NAACCR UDSC retired this data item in Version 12, as of January 1, 2010."
520,,,"The NAACCR UDSC retired this data item in Version 12, as of January 1, 2010."
3780,secondaryDiagnosis1,Tumor,"Records the patient’s preexisting medical conditions, factors influencing health status, and/or complications for the treatment of this cancer. Both are considered secondary diagnoses. Preexisting medical conditions, factors influencing health status, and/or complications may affect treatment decisions and influence patient outcomes. Information on comorbidities is used to adjust outcome statistics when evaluating patient survival and other outcomes. Complications may be related to the quality of care. ICD-10-CM codes are 7 characters long, where each character represents an aspect of the condition or procedure: the 7 characters indicate 'section', 'body system', 'root operation', 'body part', 'approach', 'device', and 'qualifier', respectively (see ICD-10-PCS Reference Manual for additional information)."
3798,secondaryDiagnosis10,Tumor,"Records the patient’s preexisting medical conditions, factors influencing health status, and/or complications for the treatment of this cancer. Both are considered secondary diagnoses. Preexisting medical conditions, factors influencing health status, and/or complications may affect treatment decisions and influence patient outcomes. Information on comorbidities is used to adjust outcome statistics when evaluating patient survival and other outcomes. Complications may be related to the quality of care. ICD-10-CM codes are 7 characters long, where each character represents an aspect of the condition or procedure: the 7 characters indicate 'section', 'body system', 'root operation', 'body part', 'approach', 'device', and 'qualifier', respectively (see ICD-10-PCS Reference Manual for additional information)."
3782,secondaryDiagnosis2,Tumor,"Records the patient’s preexisting medical conditions, factors influencing health status, and/or complications for the treatment of this cancer. Both are considered secondary diagnoses. Preexisting medical conditions, factors influencing health status, and/or complications may affect treatment decisions and influence patient outcomes. Information on comorbidities is used to adjust outcome statistics when evaluating patient survival and other outcomes. Complications may be related to the quality of care. ICD-10-CM codes are 7 characters long, where each character represents an aspect of the condition or procedure: the 7 characters indicate 'section', 'body system', 'root operation', 'body part', 'approach', 'device', and 'qualifier', respectively (see ICD-10-PCS Reference Manual for additional information)."
3784,secondaryDiagnosis3,Tumor,"Records the patient’s preexisting medical conditions, factors influencing health status, and/or complications for the treatment of this cancer. Both are considered secondary diagnoses. Preexisting medical conditions, factors influencing health status, and/or complications may affect treatment decisions and influence patient outcomes. Information on comorbidities is used to adjust outcome statistics when evaluating patient survival and other outcomes. Complications may be related to the quality of care. ICD-10-CM codes are 7 characters long, where each character represents an aspect of the condition or procedure: the 7 characters indicate 'section', 'body system', 'root operation', 'body part', 'approach', 'device', and 'qualifier', respectively (see ICD-10-PCS Reference Manual for additional information). "
3786,secondaryDiagnosis4,Tumor,"Records the patient’s preexisting medical conditions, factors influencing health status, and/or complications for the treatment of this cancer. Both are considered secondary diagnoses. Preexisting medical conditions, factors influencing health status, and/or complications may affect treatment decisions and influence patient outcomes. Information on comorbidities is used to adjust outcome statistics when evaluating patient survival and other outcomes. Complications may be related to the quality of care. ICD-10-CM codes are 7 characters long, where each character represents an aspect of the condition or procedure: the 7 characters indicate 'section', 'body system', 'root operation', 'body part', 'approach', 'device', and 'qualifier', respectively (see ICD-10-PCS Reference Manual for additional information)."
3788,secondaryDiagnosis5,Tumor,"Records the patient’s preexisting medical conditions, factors influencing health status, and/or complications for the treatment of this cancer. Both are considered secondary diagnoses. Preexisting medical conditions, factors influencing health status, and/or complications may affect treatment decisions and influence patient outcomes. Information on comorbidities is used to adjust outcome statistics when evaluating patient survival and other outcomes. Complications may be related to the quality of care. ICD-10-CM codes are 7 characters long, where each character represents an aspect of the condition or procedure: the 7 characters indicate 'section', 'body system', 'root operation', 'body part', 'approach', 'device', and 'qualifier', respectively (see ICD-10-PCS Reference Manual for additional information)."
